{
  "schema": "lmdj.materials.v1",
  "source": {
    "audio_sha256": "aaaaaaaaaaaaaaaaaaaaaaaaaaaaaaaaaaaaaaaaaaaaaaaaaaaaaaaaaaaaaaaa"
  },
  "provenance": {
    "separator_id": "fixture-separator",
    "separator_checkpoint_sha256": "bbbbbbbbbbbbbbbbbbbbbbbbbbbbbbbbbbbbbbbbbbbbbbbbbbbbbbbbbbbbbbbb",
    "separator_runner_version": "1",
    "timing_version": "timing-v1",
    "extractor_runner_version": "extractor-v1",
    "extraction_config_version": "materials-v1.0.0",
    "environment_lock_sha256": "cccccccccccccccccccccccccccccccccccccccccccccccccccccccccccccccc",
    "pipeline": "materials-v1"
  },
  "timing": {
    "bpm": 120.0,
    "beats_per_bar": 4,
    "grid_per_beat": 4,
    "length_steps": 64,
    "artifact": "timing.json"
  },
  "materials": [
    {
      "material_id": "mat_kick_a",
      "slot_index": 0,
      "role": "kick",
      "variant": "A",
      "variant_of": null,
      "kind": "one_shot",
      "source_stem": "drums",
      "audio_path": "samples/kick-a.wav",
      "playback": {"quantize": "1/16", "exclusive_group": null},
      "quality": {"status": "accepted", "score": 0.92, "warnings": []}
    },
    {
      "material_id": "mat_bass_a",
      "slot_index": 4,
      "role": "bass",
      "variant": "A",
      "variant_of": null,
      "kind": "loop",
      "source_stem": "bass",
      "audio_path": "samples/bass-a.wav",
      "playback": {"quantize": "1/16", "exclusive_group": null},
      "quality": {"status": "accepted", "score": 0.87, "warnings": []}
    },
    {
      "material_id": "mat_phrase_a",
      "slot_index": 7,
      "role": "full_mix_phrase",
      "variant": "A",
      "variant_of": null,
      "kind": "full_mix_phrase",
      "source_stem": "original",
      "audio_path": "samples/phrase-a.wav",
      "playback": {"quantize": "1/16", "exclusive_group": "full_mix_exclusive"},
      "quality": {"status": "accepted", "score": 0.9, "warnings": []}
    },
    {
      "material_id": "mat_kick_b",
      "slot_index": 8,
      "role": "kick",
      "variant": "B",
      "variant_of": "mat_kick_a",
      "kind": "one_shot",
      "source_stem": "drums",
      "audio_path": "samples/kick-b.wav",
      "playback": {"quantize": "1/16", "exclusive_group": null},
      "quality": {"status": "accepted", "score": 0.82, "warnings": []}
    }
  ],
  "pattern": {
    "pattern_id": "pattern_primary",
    "length_steps": 64,
    "events": [
      {"material_id": "mat_kick_a", "step": 0, "velocity": 108},
      {"material_id": "mat_bass_a", "step": 0, "velocity": 100},
      {"material_id": "mat_kick_b", "step": 8, "velocity": 96}
    ]
  },
  "slot_decisions": [
    {"slot_index": 0, "status": "accepted", "material_id": "mat_kick_a"},
    {"slot_index": 1, "status": "empty", "reason": "no_candidate"},
    {"slot_index": 2, "status": "empty", "reason": "no_candidate"},
    {"slot_index": 3, "status": "empty", "reason": "no_candidate"},
    {"slot_index": 4, "status": "accepted", "material_id": "mat_bass_a"},
    {"slot_index": 5, "status": "empty", "reason": "source_silent"},
    {"slot_index": 6, "status": "empty", "reason": "source_stem_unavailable"},
    {"slot_index": 7, "status": "accepted", "material_id": "mat_phrase_a"},
    {"slot_index": 8, "status": "accepted", "material_id": "mat_kick_b"},
    {"slot_index": 9, "status": "empty", "reason": "variant_not_distinct"},
    {"slot_index": 10, "status": "empty", "reason": "variant_not_distinct"},
    {"slot_index": 11, "status": "empty", "reason": "variant_not_distinct"},
    {"slot_index": 12, "status": "empty", "reason": "variant_not_distinct"},
    {"slot_index": 13, "status": "empty", "reason": "variant_not_distinct"},
    {"slot_index": 14, "status": "empty", "reason": "variant_not_distinct"},
    {"slot_index": 15, "status": "empty", "reason": "variant_not_distinct"}
  ]
}
